subreddit,combine_text
tea,Iam trying dandelion honey for the first time and want to put some in tea what kind of tea mixes well with dandelion honey ? I was thinking maybe oolong but I want to ask somebody who has tried dandelion honey in tea before. Trying dandelion honey tea recommendations please :)
tea,"I recently got a tea sampler from What-Cha, including some Sencha and Gyokuro green teas. I don't have a kyusu, only a traditional Western-style 24oz teapot, some 12oz infuser cups, and a 100ml gaiwan for brewing vessels. From what I gather, brewing sencha in a gaiwan is unpleasant because the leaf absorbs the water and clogs the lid, and I worry that it may be difficult to brew sencha in such a large teapot.

I would love to experiment, but my sample for each green tea only contains 10g of tea, and I don't want to waste it all before getting to drink it! Would any of the brewing vessels/styles I have available to me suit these teas at all, or should I wait for my next paycheck to invest in a kyusu pot? Sencha Without Kyusu?"
tea," Found a beautiful hand crafted tea pot at a thrift store for under $2 not sure what they are worth, but I love it"
tea, My mom found a little tea store in FL and surprised me with a variety of their teas for my birthday. I'm pretty excited to try them out!
tea,"According to this website, tomato leaves are edible.

[https://www.gardenbetty.com/tomato-leaves-the-toxic-myth/](https://www.gardenbetty.com/tomato-leaves-the-toxic-myth/)

Has anyone attempted to make tomato leaf tea? If so, how was your experience? Was the leaf still raw or dried? Tomato leaves for tea"
tea,"What are you drinking today?  What questions have been on your mind?  Any stories to share?  And don't worry, no one will make fun of you for what you drink or the questions you ask. 

You can also talk about anything else on your mind, from your specific routine while making tea, or how you've been on an oolong kick lately. Feel free to link to pictures in here, as well.  You can even talk about non-tea related topics; maybe you want advice on a guy/gal, or just to talk about life in general. What's in your cup? Daily discussion, questions and stories - May 23, 2021"
tea,Is Harney and sons a respectable brand for high quality tea? I like getting tea from authentic brands that aren’t “white washed” and I know that this is an American brand. Is their Darjeeling and lapsang souchong actually good? Tea aficionados I have an important question!
tea,"Floating Leaves is out of the former atm. US-based/affordable US shipping please. TIA! Recs for a good, affordable Jin Xuan or Tieguanyin?"
tea,This stuff is a blessing and a curse. Ive been having trouble sleeping so i drink some valerian root tea every other night or so. As a result ive had some super cool vivid dreams as well as falling asleep quick when i drink it. This is also true if you have a nightmare. Before tonight Ive never woken up in a pool of sweat and stared at my door with paranoia that the terrible things from the nightmare were about to bust through. Ugh. And i was only asleep for about an hour and a half. Just a cautionary tale for you fine folk. Valerian tea
tea,Hopefully so because im drinking it right now lol Found some bagged oolong in the back of my cabinet that I bought 2-3 years ago. Should it still be good to drink?
tea, Dandelion tea
tea," I had no idea green tea could be this good, or that a daily tea break with my husband would be so enjoyable. Thank you, community, for the tea seller recommendations!"
tea, Tried making my own tea blend with Lapsang Souchong!
tea, The beauty of Butterfly Pea tea
tea,"The specialty of second fuse tea is a durable and strong flavor as compared to 1st and 3rd. Very excited. Because of late rainfall in the northeast India region, the second fuse coming late this year. Assam/ Darjeeling Tea Second fuse tea Production starts soon."
tea, Anyone know where I can get teapots like this that aren't porous? Please help
tea,"I've bought or used a couple types of tea ball cages in the past. They always seem to end up not being tight enough and letting Tea leaves fall through. Anyone use one that really holds up and contains the tea.  

I started using the cloth bags but I'd rather have something more reusable I'm looking for a recommendation for the best loose leaf tea infuser"
tea,"When I drink silver needle tea I feel much more centered and focused than if I just drink a peony or something similar made of mostly leaves.

Anyone else notice the same? Is it perhaps because of higher L-theanine content in the buds?

I love the taste of lots of different tea, so this isn’t really a taste thing per se, it just seems to be a different mental effect. Anyone else notice the difference in mood between buds and leaves?"
tea,I know not all teas are the same but a problem I seem to have with my teas is when I brew them hot I don’t seem to get as deep and strong flavor as I do when I cold brew them. I’ve tried playing with water temperature and the amount of tea I put in but how do I get a stronger tea when I don’t have the time to overnight brew Stronger Flavors?
tea,My ceramic/steel one broke and they only sell aluminum around here.  I have some vague idea you shoulfn't cook with aluminum.  Anybody know the truth of it?  Thx. Hello! Aluminum teakettle?
tea, Is this smoked yerba mate? What should it taste like?
tea, Holding a 5kg Xiaguan cake from 2003 ; that's 11 pounds of tea!
tea, Matching Fountain pen and tea cup
tea,"Hello!

New to getting IN to tea and have started buying plants to grow myself like mint and lavender.

I want to get into growing Camellia Sinensis for its range of tea variety. From reading, I know it’s a long term commitment but it sounds like a fun and potentially very rewarding process.

Any advice from people growing tea indoors or in greenhouses?

Thanks! Camellia Sinensis Growing"
tea,"Hi there,
when it comes tea of Taiwan.
What will come to your mind?

If there is a chance,what kind of Taiwanese tea you will like to try? Taiwanese tea"
tea, Happy International Tea Day! This was my final project (albeit a small project one) for my chemistry class. Hope you enjoy!
tea," So a week and a half or so ago, I posted that I had really been getting into Pu’erh tea. Well this amazing community gave me some awesome feedback but u/diffitt when over and beyond and welcomed me to the Pu’erh community by sharing his wealth of knowledge but also samples of 5 Pu’erh’s!!!! ☕️"
tea," Never had cherry blossom before, I’m so excited!"
tea, Jasmine Pearl in my yunomi from Kyoto!
tea, Happy International Tea Day!! 🍸
tea,"When I search tea on Google or other platforms, it usually brings up gossip channel. I am so glad tea means tea here. Thank goodness tea is tea on Reddit so far."
tea," Raw Pu’er Tea (Spring 2020) from Yiwu moutain, Yunnan, China. Have a nice day, all tea friends!"
tea,"What are you drinking today?  What questions have been on your mind?  Any stories to share?  And don't worry, no one will make fun of you for what you drink or the questions you ask. 

You can also talk about anything else on your mind, from your specific routine while making tea, or how you've been on an oolong kick lately. Feel free to link to pictures in here, as well.  You can even talk about non-tea related topics; maybe you want advice on a guy/gal, or just to talk about life in general. What's in your cup? Daily discussion, questions and stories - May 22, 2021"
tea," UK Consulate responds to US Embassy ""celebrating"" International Tea Day"
tea, Happy International Tea Day! Green tea with jasmine
tea,"Some backstory/findings (Question below)
Hello people of this beautiful subreddit! I recently ordered and received a pack of butterfly pea flowers, dry. I heated some water (I dont have the same meticulous procedures as some of you may have), put some leaves in an infuser (not sure how it's called) and I put in the hot (almost boiling) water. At first it was a very light blue, but it very quickly became vivid forest green. Adding lemon made it brown/golden. Cold brewing made it insanely purple, almost gray/black in color, but after a few days it also turned golden. Funny thing is, the first batch I mentioned, I left in the sink for later cleanup, and it leaked the deepest blue I've seen in any picture online (too bad it was in dirty dish-water), made a whole cup this beautiful blue, to which I added some lemon juice it turned a mesmerizing pinkish purple. 

My question is how do I consistently get that vivid and lively blue color without having to worry about the rest of the spectrum. I dont need to make a big batch that I can count on for later use, I prefer to make it on the spot, be it cold brew or hot. I just need to hit that consistency. Suffice to say I've gone through only the first like 6 results on google, I expect this sub to have a better answer Confusing butterfly pea tea colors"
tea, Happy international tea day from Egypt ☕🍵
tea,"hi tea people

anyone know a good brand of tea on amazon or other site that ships to mexico? Good tea at Mexico"
tea, International Tea Day greetings!
tea, International Tea Day
tea,"A couple bags of shincha have finally arrived (Ippodo). I'll be consuming a bag (100g) right away but I wouldn't finish it for a month or so. For freshness, where is the best place to put the 2nd bag? The freezer or fridge? Thanks. Shincha storage"
tea,I was looking to order some tea and I stumbled upon this site. Just wanted to know if it was legit or not. Has anyone ordered tea from “wildhibiscus.com”?
tea," What tea is this, and what quality is it ? (Good/Bad/Meh?)"
tea, Was gifted this stunning (but mismatched) English bone china tea set recently
tea,"So I baught my gf some loose tea from a small shop in our town with a lovely shop keeper. She had some great smelling teas. At the end I went with an apple tea. Breed from the instructions with boiling hot water, one tablespoon of tea and letting it sit for 8 minutes. It smelled great but the taste was bestell noticable. Did we do something wrong or is loose tea something you need to adapt to after being used to store baught tea? Anybody knows why loose tea tastes like hot water?"
tea, Brand New Tea Review Show | Tea Time With Tea J. - White 2 Tea’s 2016 Shoumei Fuding Fujian White Tea.
tea," Made some Kashmiri Kahwa tea from scratch to honor International Tea day! I had visited kashmir recently and learnt this, the Indian spices and saffron strands are an absolute bomb on your taste buds!"
tea,What Tea are you drinking today ! I just had a cup of Jasmine Green Tea and watched the rain. It was lovely! Happy International Tea Day to all the Tea Lovers!
tea, A nice sencha for spring time!
tea, Treated myself this morning to a homemade dirty chai latte
tea, guess what kind of tea it is..
tea,I want to increase my collagen intake and read that ginseng tea helps with that amongst other great properties. I was happy because I figured woohoo! More tea for me to drink. Any good brands that have a great ginseng that y'all might recommend? :) Best ginseng tea?
tea, Happy Tea Day!!!
tea,"I'm thinking of buying a smaller chawan, to serve as a chawan and a teabowl. My question is, is kyo-yaki pottery foodsafe? As far as I know, e.g. Raku is not advised to be used with tea for longer periods of time, just matcha in, whisk, matcha out. I am, however, not sure about kyo-yaki. Is kyo-yaki pottery foodsafe?"
tea, The beginning of my green tea drinking journey!
tea," *Warning- I may hurt feelings* On a road trip today, decided to try a Matcha latte. All I can say is- Matcha is for horses. Did they liquify a barn and then pour it in a cup?!? It looked so appealing on this sub- why was I never warned?!?"
tea,"Hello everyone! I’ve always wanted to learn about proper tea making or tea ceremony but I have no idea where I can get it online (preferably free since I don’t have any access to online banking). I’ve seen some videos on YouTube but I’m not sure if it’s the real thing since I really can’t tell. I’ve been drinking tea since I was 14, and as I grew older, I’m thinking that I’ve been doing it wrong the entire time. I want to enjoy tea the proper way. I also want to learn about the ceremony since I found it fascinating after watching it once on TV. It would also be great to have it as a skill. Does anyone have any suggestions? I would really appreciate it. Online tea classes"
tea, Wuyi Origin Tea arrived today!!!!
tea,"Grit-tea
Happy international tea day! Which tea is hard to swallow?"
tea, Got a new pot and and old brick from Teas We Like
tea,I have a few glass artists and I'm having a couple of borosilicate tea cups made but I would really like to discuss with a ceramic artist... Has anyone ever had a tea set made for them?
tea,"Several years ago, travelling through the middle-east, I was in a market and a tea merchant was selling this blend of tiny chopped up fruits (mainly ginger, cranberry, maybe mango? ) with some nicely scented spices or flowers or something mixed in. He said it was to add to tea in place of sugar or honey. I bought a kilo or so and loved it but of course now it's all gone and I want more. Obviously I could try to make my own but I dunno, I just want the real deal. Anyone know what it is or where to get it? Tiny chopped up dried fruit and spice blend to add to tea: what is it called and where can I get it?"
tea," GOTTA STAY HYDRATED! Quite the interesting blend, a nice way to end the night"
tea,"What are you drinking today?  What questions have been on your mind?  Any stories to share?  And don't worry, no one will make fun of you for what you drink or the questions you ask. 

You can also talk about anything else on your mind, from your specific routine while making tea, or how you've been on an oolong kick lately. Feel free to link to pictures in here, as well.  You can even talk about non-tea related topics; maybe you want advice on a guy/gal, or just to talk about life in general. What's in your cup? Daily discussion, questions and stories - May 21, 2021"
tea, Earl Grey de la creme from my favorite tea shop.
tea, International Tea Day 2021: Facts You Should Know - Bulletin Buzz
tea,"I am trying to drink more green tea. I have a small travel water boiler which makes enough for a single cup. However, I don’t have a travel cup, nor loose leaf tea to use with said cup. 

I’ve thought about buying a thermos that has room for loose leaf tea at the bottom. But I also know that tea “packets” exist where you just drop them into the water and then pull them out once brewing is done.

My ultimate goal is to be able to carry tea with me in my backpack such that I can make a cup at any time and drink it during traveling, but not add too much weight to my backpack. Bonus points if whatever I buy doubles as good for camping, since I already have a camping pot I can boil water with. 

Thanks for any suggestions! Looking for travel tea options, mostly green."
tea, Anyone seen or heard about this type of tea before?
tea,"Any time someone disagrees with a tasting note I write for tea, they are not 'wrong’, because I am not ‘right’ – Everyone perceives things differently, and that is not solely based on ability. There are several factors at play that I would like to review and perhaps have a conversation about if you feel so inclined.

**Sample Material Variability:**  
Despite coming from the same source, one 5g sample of tea will not be the same as the next 5g, though in most cases they should be very similar. As surely every tea drinker has witnessed, tea from the ‘top of the bag/tin’ is different in size from that which finds its way to the bottom. Different sizes will extract at different rates.

Secondly, if 1g of the first samples 5g was trichome covered buds, but 2g of the second sample was trichome covered buds, a conscious consumer would *expect* the sensory experience between the two pots to be different; and this doesn’t even account for differences in water, teaware, etc.

**Infusion and Perception Variability:**  
Our ability to discover an aroma in something (depending on what it is) can be as impressive as 1 part per trillion for the most odorous compounds known. That’s equivalent to a 1mL drop in a lake-sized body of water! This ability stretches and shrinks between different chemical compounds over at least 11 orders of magnitude.

Different volatile chemical compounds in the tea leaf will be released into the water at different lengths of infusion time. Different volatile chemicals in an infused tea will be released into the air at different times. The most volatile compounds are released first and don’t linger. As they fade, the medium volatile compounds begin to appear. As the medium volatile compounds fade, the least volatile compounds come into focus and persist. The perfume industry refers to these stages as the top, heart, and base notes of an aroma.

Therefore despite their best efforts, someone who doesn’t interact with the tea during the first several minutes after it has been brewed will miss several stages of the aroma development; and someone who doesn’t try to appreciate the aroma of the tea may only find its top notes, it stands to reason why opinions can differ so greatly.

The sensitivity of our palates and our ability to transcribe scents to words is another factor. I am surely partially blind or totally blind to certain compounds and hypersensitive to others, and the reverse will be true for the next person. In extreme cases, 2 people could smell the same odor and describe it completely differently. This is perhaps not due to our physical limitations to detect aroma but our lack of fluency in describing what we smell, perhaps both. In the food and fragrance industries, companies will form panels of judges so that their averages can paint a more reliable picture of what people perceive.

I brew and recommend my customers to brew teas with rather specific extraction parameters. The reason is that through my testing, to my taste, and what I can perceive with my abilities and circumstances, I’ve found those parameters will create an infusion that puts the tea in the best possible light. Although things taste differently from person to person, I do not have a panel of people to gather data from, nor do I believe that data would be useful at the scale of which I operate. I believe my parameters to be a wonderful starting point from which the recipient can adjust to suit their tasting ability.

**Elemental and Configurable Senses:**  
An aroma is not just a sum of its chemical parts, and our ability to comprehend an aroma comes down to how we perceive it. If two aromatic compounds are blended, one person may perceive the blend as identifiable compounds A + B while the next person may perceive it as C. The analyzable A + B compound is referred to as an elemental odor, while the C compound is a configural odor. If you put a Caprese salad in front of someone blindfolded and asked them what it is, do you think it’s more likely they say ‘basil, tomato, mozzarella, balsamic’ or ‘Caprese salad’? What about tea? I don’t know about you but I’ve met my fair share of people who don’t smell anything in tea but ‘tea’.

I suppose it’s safe to say our comprehension of aroma is based on life experience. Configural sensing seems to be our default, we live on auto-pilot, and configural sensing saves us a lot of somewhat pointless thinking. Elemental sensing is something that can be learned and is especially useful in the process of ‘reverse engineering’ aromas. Depending on whether you find enjoyment in using your brain as an analytical tool, flipping the 'Elemental Sensing' switch to 'Always On' can be a very rewarding life choice. It just takes practice, awareness, and energy.

This is an article I will hopefully continue to expand on as I learn more about odor and how our bodies interact with it. If you think it's interesting, please consider sharing it with others. Bye for now! Tasting Notes?"
tea,"So im fond of English breakfast tea with milk and honey. However, I have noticed a disturbing problem with this...Ants! 

At home near where I keep my honey, I have ants. When I bring my tea with me to work I notice in the morning before I even arrive there are ants on my desk. I try to make my cups clean of any honey residue, but they seem to follow me on my way to work. Is it time to ditch the honey? I have an embarrassing problem..."
tea,"could be from any country with a reasonable shipping fee

i want reasonable prices and green tea without pesticides. bonus if they have a good jasmine tea and good chamomille. which site do you prefer ordering from in sweden?"
tea,"Noble tea friends, I have decided to try the world of loose leaf tea.

My kettle makes a max of 0.8L which is around 27 fl. oz. or 3.3 cups.  If I'll be using an infuser what would be around the right size teapot? 

Bonus question: Regarding teapot type, which might keep tea warm the longest? (I'm a slow sipper!) Help on teapot size"
tea,"I've tried lots of teas from different online stores, and I have some favourites but would like to try even more. There's one online store that I love but delivery is ridiculously overpriced and takes 1-2 months. Can anyone recommend a good online store with high quality japanese teas? And what are your thoughts on Tsujiri?"
tea,"Im fairly new to the tea world but have quickly fallen in love. 

Lately, Ive been enjoying Harney’s japanese sencha hot, brewing 3g for about 100 seconds at 80C. However, after icing the same brew the tea I can no longer enjoy it. Instead of those steamed and lemony notes, I pick up a sort of sharp stale taste. 

Thinking my ice was not pure, I also tried just cold-brewing my tea for 18h with similar undesirable results. My tea looks great and smells great before brewing. Im sort of confused on why this is happening to me, especially considering that I will enjoy a cup even at room temperature.

Has anybody had this happen to them? How do you guys enjoy a cold sencha? Cold Sencha-Tips?"
tea,"So I wanna experiment more with ahmad tea 
Mainly i prefer plain black tea or like english breakfast, fruity tea and floral tea was never for me, I feel nauseous from the smell and can't get past 2 sips, ik it's weird but i just can't stand the fruity flavor with black tea. 
So i was thinking of exploring other flavors from ahmad (i tried EB) like darjeeling, assam, cyelon, cardamom 

What do u think about those?
Is ahmad earl grey better or twinings? What's your favorite ahmed tea blend?"
tea, LongJing with goji berries
tea, I just want to remind everyone that there is an American Tea Ceremony......
tea,"Hello! For those of you who have bought tetsubin new, what did the urushi spots look like? Were they always black, or sometimes other colours? Urushi spots on interior of tetsubin - always black?"
tea,I’m really getting into tea lately and I was genuinly curious what grade it is. Is it even worth it or do you guys reccomend better brands? What grade of tea is kusmi tea?
tea,"Greetings,

Here's the deal. Yesterday I was using a Capresso glass kettle to boil my water for tea and it came out the same as all the previous days. Today, I bought a 3L Tiger kettle/warmer. I set it to 208F and made my tea exactly as I normally would.

Unfortunately, the tea came out very weak and almost flavorless.

Again. The ONLY thing that changed between yesterday and today is the kettle I used to boil the water.

Same water (tap) at the same temperature, same tea in the same amounts, same mugs, same steeping time. 

It wasn't just my tea, either. My wife complained that her tea today was weak and flavorless as well.

Any thoughts as to why this happened, and how I can fix it, beyond the obvious ""add more tea leaves""? Tea steep has changed?"
tea,"Sorry if this isn't the place to ask, but I've tried searching the internet and I can't really find anything conclusive.

In short:

What type of tea is grocery store ""Black Tea""?

Where can I find loose leaf versions of this ""Black Tea""? Store suggestions?

I grew up in the South on Luzianne tea, and now that I'm an adult, I've moved on to store-brand tea because there's no citrus in the tea and it's just plain black tea. Now, though, I'm trying to move away from using tea bags because using 5-6 individually wrapped tea bags per pitcher feels wasteful. So I wanted to look for just loose black tea, but apparently there's no such thing! I can't find anything just labeled black tea, any info on what kind of tea ""Black Tea"" is, and going to grocery stores (Kroger and Target), they don't even have tea that isn't in a bag.

Sorry if this isn't the right place to ask. If there's a better place, please feel free to point me in that direction! Couple questions about loose leaf black tea from someone who knows nothing!"
tea,"Hi All -

I’m trying to cut down on sweets after dinner. I have found that a cup of Jasmine tea with just a dash of honey quiets my sweet tooth while not being an entire sleeve of cookies. 🤣

It’s time to replenish my supply - anyone have a favorite? Favorite Green Jasmine ?"
tea, Moonlight Beauty (Yue Guang Bai) and its biggest question: puerh or white tea?
tea,"I'm Considering buying these tea cups so my brother and I can have Gong Fu sessions. Heard that glaze can be bad for you though. 

So is the material that these cups are made out of and the fact that they are glazed okay? or are they not that safe looking?

 [Black Magda Character Half Glaze Tall Teacup - teawarehouse](https://teaware.house/products/black-magda-character-half-glaze-tall-teacup) 

 [Geyao Fish Teacup - teawarehouse](https://teaware.house/products/geyao-fish-teacup-1?_pos=1&amp;_sid=a816e7135&amp;_ss=r) Are these two tea cups safe?"
