subreddit,combine_text
tea,"What are you drinking today?  What questions have been on your mind?  Any stories to share?  And don't worry, no one will make fun of you for what you drink or the questions you ask. 

You can also talk about anything else on your mind, from your specific routine while making tea, or how you've been on an oolong kick lately. Feel free to link to pictures in here, as well.  You can even talk about non-tea related topics; maybe you want advice on a guy/gal, or just to talk about life in general. What's in your cup? Daily discussion, questions and stories - June 16, 2021"
tea,"We realize there are lots of people involved in the tea industry here, so this thread is a weekly feature where anyone can promote their current projects without worrying about the self-promotion rules.  Feel free to include links to your shop, crowdfunding sites, surveys, sales, or discount codes.  The rule against claims of health benefits remains in effect here.  It should go without saying that we still expect people to be respectful and follow the reddiquette.  While we intend for this to be a free-for-all promotion zone, please don't overrun the thread posting the same thing over and over. Marketing Monday! - June 14, 2021"
tea," Tea Testing for quality check. flavor, liquor, infusion, color, third-party substance presence testing."
tea, Hello. I decided to share with you a photo of my fabulous house in the forest. What a special atmosphere.
tea, A little black tea and cookies for breakfast at work. Florence by Harney and sons
tea, Japanese Kutani Satsuma Dragonware - I’m obsessed 😍
tea," New kyusu arrived from Tokoname, Japan!"
tea, Mix for Hojicha latte.
tea, My husband got me a tea cup from the Empress in Victoria with the Queen Victoria design. We had afternoon tea there once.
tea," Is this safe to use? I think it’s ceramic, Vintage Danish"
tea," This is a black tea, its name is ""duck shit fragrance"", do not be deceived by its name, the aroma of this tea is very charming"
tea, Brass dragon tea pet
tea, What’s your guys fav part of my haul
tea,"Hello leaf juice enthusiasts! I have a question for you. I want to make myself a ""tea corner"" and I want to buy some teaware for it, I am looking for a Kyushu clay teapot. I have checked the Amazon and not quite sure if the quality of it is good enough to be used almost everyday. Can someone recommend me a website or send a link to good enough one on Amazon?  Thank you! 😊🍵 Where and how to buy teaware"
tea,"I think these might be called sun-teas? But in this case not necessarily being put in the sun... I wanted to ask if we get a lower nutritional takeaway from making a vegetable or flower water than we would from blending it or boiling it? I read recently about okra-water, where you put the sticks in a mason jar, cover to the top of the sticks in water, leave it overnight and then drink the water the next day. I have had a mental block about consuming the moringa leaves I have ( I usually blend them and it's gross) so tried the water method, the water was a lovely clear-medium-green the next day and it wasn't gross at all to drink. Is this a wonderful hack that people don't really talk about? Or am I getting less out of the plant than if blending it. Before you answer please keep in mind: (i) I dont believe in using the powder form as it grows everywhere in my country and would rather go with fresh (ii) I'm not worried about losing out on fibre if that was going to be one of the points being made, as I'm vegan and get it in abundance [veg or flower] water vs tea"
tea," My favorite tea! From Margaret's Hope estate, Darjeeling, India."
tea," I am calling this ""roasted butterflies"""
tea,"I am have trouble using soda (Coca-Cola to be exact) to get through my day. I am trying to healthier drinks and want to try tea. Only problem is the tea that I bought (Celestial Seasonings herbal tea) makes me gag and nauseous. I make the tea by heating up my kettle to boiling, letting the tea bag soak, letting it cool down a little, then consuming it. Did I buy bad tea or am I just messing up the brewing prosses majorly? If I bought bad tea, do you have any suggestions?  


Edit: I should make it more clear that I liked the taste of it but it made me feel like I need to vomit after a couple of sips. I was curious if it was something on my end or if I just bought bad tea. Good tea for a beginner trying to get off of soda (also why is the tea I bought making me gag)"
tea,"I'm looking to get into tea and am starting from scratch. I prefer to shop local so I'm hoping for recommendations on a store around Seattle that has a good selection of quality teaware and knowledgeable staff. 

I'm also looking for recommendations on a good setup. I WFH in a detached garage with no plumbing and this is where I would like my tea station. I will need a water vessel, electric kettle (I've done lots of research on that so no recommendation needed there) and a flexible brewing solution. I think I'm more interested in Asian style teas than western. 

Any help is much appreciated! Best shop for teaware in the Seattle area and tea set recommendations"
tea,"Hello! This may sounds like a stupid question but I don't know a lot about teas (I just know I like them lol). Im starting taking care of myself and I've heard that green tea have a lot of benefits on our body (I noticed it too!) So I started to drink it. After weeks, it's started to taste like shit for me 😭 so I bought Strawberry and Mandarin tea, and it's excellent.

 I wanted to know, if I mix a bag of strawberry tea and a bag of green tea in the same cup, will the green tea mix with water and keep its effects?

Thanks! Mixed green tea?"
tea, Just Wanted To Share my New Set
tea,"Hello tea masters and fellow tea lovers of the online world. I'm far too English and the heat is absolutely killing me at the moment, I've tried to make iced jasmine tea but it's super bitter and I can't figure out where I'm being an idiot, any and all ideas welcome.

Method:
Loose leaf jasmine tea
75 degree Celsius water
3 minutes
Strained
Stir in a little pure honey
Poured into a bowl full of reusable ice cubes (to quick cool without watering down)
Taste
Squish up face exactly like when you accidentally spray deodorant into your mouth.
Make a crunchy throat noise as you forget what sweetness is.

When I drink it hot this tea is delightful and fragrant without any bitterness. Iced jasmine tea troubleshooting: bitterness"
tea," I can't resist to not to share it,my friend sent me this image and I love it 😍"
tea,"I have a great jasmine peony green tea that I enjoy so I know some part of the peony is edible.  I have fresh peony flowers and I want to make tea from it, but different articles say they’re poisonous and some articles say they are edible.  Does anyone have definitive knowledge on if they are edible or not and what part of the flower to put in the tea?  Thank you!! How do you make peony tea?"
tea,Near the Plateau would be ideal! Best tea houses/cafes with great tea in Montreal?
tea, Cute tea cup set I got at a garage sale this past weekend (Pot not included)
tea, Attempted Kouridashi. Hot weather calls for cold green tea!
tea," Noon Chai/Pink Tea won't get pink. I used the gunpowder from the picture and 1/4 of a tablespoon of soda and boiled it with the spices for more than 1,5h - shocked it with ice, added milk and it's only brownish. Did someone ever get it done? Are there internationally available green teas that work?"
tea,What are some of the best tea party menus in your opinion? Tea party menus
tea,Does anyone know where I can find one? I have an electric stove and want to use it to make the tea as well. Does anyone have any suggestions? Where to find good quality Moroccan Tea pot and set of glasses?
tea,"Hello all. I’ve been browsing for a lot of the pots, but now I need to buy some new tea. What are “good prices” on teas these days? What is a good target price? Five dollars an ounce? Six? What is it a good tea price?"
tea,Is there a name to look for specifically in green tea if I want more of a floral flavor? I am wanting something leaning towards jasmine but not quite as intense if that makes sense. Am i being too specific?  Maybe this doesn't exist? Needing help picking a green tea
tea,"So looking for some flower teas to add to my collection/ blends of flowers that would go well together .

Here’s the list of my existing collection:
-Apple flower (this I regretted purchasing)

-butterfly pea tea

-chrysanthemum

-lavender 

-osmanthus 

-rose

-jasmine 

Also have some stevia and a mint plant if that helps. Flower tea recommendations and blends"
tea,"New to tea here, and I'm just curious about everyone's opinion on the best type or brand of green tea. Feel free to include loose leaf variants, but I dont know how to brew loose leaf yet. 😅 What's your favorite Green Tea?"
tea," When your original gift idea fails, tea is a great backup 😌"
tea, In Love With My New Van Gogh Tea Set!!
tea, So cool
tea," This has been a wip I've been teasing for quite some time. My tea shrine, repurposed from the drawer it's housed in. Only spent money on the shelving brackets. I didn't have time to edit or go great into detail of this setup rn I'm getting ready for work, but tomorrow is my day off I'll post more :)"
tea,"&amp;#x200B;

Can anyone point me towards an affordable gongfu tea set with tea tray? I've been looking on amazon with no luck. Looking for and affordable Gongfu tea set and tea tray with plastic tray"
tea," Thinking to buy... worried about paint job rubbing off, washing off, etc... Any thoughts?"
tea,"I recently got hooked to Matcha and started with ordering two different matchas from Amazon. One was Ippodo. 

Then discovered Sazen tea. Ordered the tea on Thursday and got it on Tuesday. Super well packed. 

Got two packs of Matcha Wako and one pack of Matcha Kinrin. Tea was 40% cheaper than US prices and even with shipping it is cheaper. Plus I am guessing fresher. 

Anyway super happy with the ordering process. Sazen tea review"
tea,"I tried making Moroccan mint tea recently just in the teapot I have. It was really nice, but I can't help but want to try going a bit more authentic Can anyone recommend somewhere to get a decent Moroccan tea pot and glasses in the UK?"
tea,What your favorite tea for a hangover? Doesn't necessarily have to help with the hangover btw. Typing this while drunk so i think future me is gonna be really happy I posted this What's your favorite tea when you have a hangover?
tea,"
1st steep refreshingly vegetal, savory and mouth coatingly buttery. Very fresh, wet leaves smell like steamed spinach. 

2nd steep is just as savory, thick, and fresh. Not much change. 

3rd steep the flavor does begin to fade a bit, but the texture is still good. Not bitter or scratchy. Still enjoyable. 

4th steep does start to get bitter, but it isn’t scratchy, which is surprising. It gets less pleasant to drink when it cools down, so this cup got drank quickly. 

5th steep is not enjoyable, the texture crashed and so did the taste. 

Thistea sent me this tea for free for review, and with this and the laoshan being so enjoyable I must say I will order from them in the future. Both of them were pleasant experiences and I believe high quality teas. I see little dust in the packaging and nice whole leaves in both teas. Thistea anji bai cha review"
tea, can anyone who's tried it suggest a similar tea to it? it's one of my favorite. living in australia now so i realized i won't be able to stock up on it this holiday season.
tea,"I mostly drink Bigelow English Teatime and Oolong, Twinings Irish Breakfast, and Tadin Spearmint.  Sometimes Lipton Orange Passionfruit Jasmine Green Tea and Bigelow Plantation/Perfectly Mint get into the rotation as well.

I like tea with strong, bold flavors without much bitterness.  The Bigelow Oolong is dark and slightly fruity like the hot tea I've gotten at Chinese restaurants.  I've tried other Oolong teabags that were lighter and more grassy/buttery.  

A lot of the loose Oolong I've looked at sounds like it's more the lighter flavor profile.  Any darker, stronger Oolongs that are fairly inexpensive?  Or any strong but smooth black teas like breakfast tea?  Also open to tea with spearmint or fruit added. Looking to try moving up from teabags to loose tea, need some recommendations"
tea, June 2021 White2teaclub
tea, Care package straight from Taipeh
tea, Looking for someone to teach me the basics of tea blending. Any recommendations on instructors/courses I can do remotely?
tea,"Doing a little market research. Does anything come to mind when thinking of ""cool"" tea-specific shops/brands in North America, that are more similar to trendy, professional coffee brands/shops and less nose-up than some of the traditional shops? Something more directed at the 18-34 year old range... the only thing I can think of is DavidsTea and that feels a tad too commercial still, and everything else feels too DIY.

Some examples of coffee brands that have this feel I'm thinking of:  
[https://www.instagram.com/dayglowcoffee/](https://www.instagram.com/dayglowcoffee/)  
[https://www.instagram.com/nofreecoffee/](https://www.instagram.com/nofreecoffee/)  
[https://www.instagram.com/counterculturecoffee/](https://www.instagram.com/counterculturecoffee/)  
[https://www.instagram.com/auntsetuncles/](https://www.instagram.com/auntsetuncles/) Does anyone know of any ""cool"" tea-specific shops/brands in North America, that are professional but less pretentious than some of the traditional shops?"
tea,"I love peach-flavored black or white tea, can you recommend an herbal or decaf or rooibos version?  Could also be apricot or litchi... Thanks! Favorite non caffeine peach tea?"
tea,"What are you drinking today?  What questions have been on your mind?  Any stories to share?  And don't worry, no one will make fun of you for what you drink or the questions you ask. 

You can also talk about anything else on your mind, from your specific routine while making tea, or how you've been on an oolong kick lately. Feel free to link to pictures in here, as well.  You can even talk about non-tea related topics; maybe you want advice on a guy/gal, or just to talk about life in general. What's in your cup? Daily discussion, questions and stories - June 15, 2021"
tea,Do you guys know if it’s possible to pour hot (~95 C) water directly into a porcelain teapot without it cracking? Teapots and hot water?
tea," Drinking some twinings irish breakfast with a bag of chamomile. Taking a look at my grandfather's old playing cards. He passed away when I was just young, and this is one thing I have of him that still lives on. A nice calm evening like this is what I needed after a hard days work."
tea, Tea (and a little coffee) shelf is installed!
tea,"Hello!
I’m fairly new to matcha but I’m obsessed with a lightly sweet matcha latte with almond milk. I’m looking into what I need to get started and have my eyes on a nice set but how exactly do I brew it? Hot water then mix with almond milk? Just mix it directly with the almond milk? Also does anyone know if honey is good with matcha and almond milk? I don’t know if this is okay to post but any help would be greatly appreciated! Newbie with matcha please help!!"
tea, Ever since I was a kid I wanted to open a tea shop. This is my imaginary one in my kitchen :)
tea, Perfect tea for a rainy day
tea,"Breakfast tea?
Earl Grey?
Green Tea?
Would love your favorite recipe too. What’s your favorite tea for Iced sweet Tea?"
tea, Please help identify these teas?
tea, 99 in Denver today 🌞 Perfect day for some iced Caribbean Cooler!
tea, My collection
tea, Monday Morning Vibes
tea,"Anyone else spend at least 5 minutes huffing their jasmine pearls before brewing?! 😊 Could be one of the best scents in the world, IMO! What is your favourite tea scent? Huffing Jasmine"
tea," Hi guys! A few days ago I asked for suggestion on the name I came up with for a green tea brand.

However, the answers were too wide, so i need more suggestions, if you guys know any good and creative names that i can use?

I finalised ""naturaza"" and ""anTEAque"" but I would appreciate more inputs. green tea lovers i need your help. again."
tea, Had to move my tea are :(
tea, Super excited for my meager haul from Japan!
tea, Help finding samovar spigot key for this samovar?
tea, Tea is about learning to trust your own taste.
tea,"What variety of Twinings tea bags would you recommend the most? I find English Breakfast very tasty, drunk with a lot of milk and two teaspoons of brown sugar. Twinings tea bags"
tea,"I have a roughly 20oz porcelain teapot with a strainer built into the spout and was wondering how I should go about using it. I’ve generally used mesh balls or teapots with removable infusers where I can remove the tea leaves after steeping, but with this one if I were to just dump the leaves into the pot they would be sitting in the water until I finish drinking and pouring all of the tea out of it. I suppose I could just make one cup’s worth of tea, but then that defeats the purpose of the teapot. Advice on using teapot"
tea, Decided to give my teaware their own space
tea, Bringing Tea Back the Old School Way!
tea," My extremely ad hoc, paired down tea set-up this morning."
tea, Thrift store find
tea," Loving this cha hai with built in strainer, perfect to show off these beautiful emerald buds"
tea,"I'm looking to venture into the world of puerhs, but I am not sure where to start. I have read way too much on the Yunnan Sourcing site as well as some other sites. Before I just picked at random, I thought to check here for some recommendations.

I like most kinds of tea. In terms of green tea, my preference is toward Mao Feng. In terms of oolongs, I like roasted taiwanese more than others but still like Jin Xuan quite a bit. A lot of times, I start my day with Portland Breakfast from Smith Teamaker which is a blend of assam, puerh, and keemun.

Thank you for any direction or suggestions that you might have. Looking for recommendation on where to start with puerh"
tea, Discovered at a recent sale. Could you Identify with these pics?
tea,"What are you drinking today?  What questions have been on your mind?  Any stories to share?  And don't worry, no one will make fun of you for what you drink or the questions you ask. 

You can also talk about anything else on your mind, from your specific routine while making tea, or how you've been on an oolong kick lately. Feel free to link to pictures in here, as well.  You can even talk about non-tea related topics; maybe you want advice on a guy/gal, or just to talk about life in general. What's in your cup? Daily discussion, questions and stories - June 14, 2021"
tea, My tea pet is full.
tea,"T2 has lots of sampler packs which I tried during the last year. I tried each one at least 2 times, unless it was really nasty.  

I'm mostly posting this to get recommendations - based on the top scorers what else might I like? Also thought it may help some people who were overwhelmed by T2s selection - all my personal preferences of course!

    **Will definitely buy again:
    Singapore Breakfast: 9/10. Black tea with pandan and coconut. Very sweet!
    China Jasmine . 9/10. Green tea with jasmine. Fresh and crisp taste.
    French Earl Grey: 9/10. Black tea with petals. Sweet and fragrant.
    
    **Very enjoyable:
    Gyokuro: 8/10. Green tea. As good as any I bought in Japan.  
    New york breakfast: 8/10. Black tea with vanilla. Like pancakes.
    Scots breakfast: 8/10. Black tea with cinnamon, oats. Warm fruity tea. 
    Adelaide breakfast: 8/10. Black tea with cranberry,blackberry. Interesting summery taste. 
    Earl grey: 8/10. Black tea with petals.  
    Blue Mountain 7/10: Black tea with petals. Like a weaker earl grey.  
    Sydney Breakfast: 7/10. Tastes same as Blue Mountain.  
    Green Rose: 7/10. Green tea with tropical fruit. Light &amp; sweet. 
    Gunpowder Green: 7/10. Green tea. Tastes like peppermint but box says pure green? 
    Japanese Sencha GMC: 7/10 Green tea with rice. Rice is not too overpowering.
    Brisbain Breakfast: 7/10. Black tea with mango. Surprisingly nice.  
    
    **Pleasant:
    Japanese Sencha 6/10. Green tea. 
    Oolong Fresh 6/10: Oolong tea with spearmint. Good for iced tea. 
    Melbourne Breakfast. 6/10. Black tea with vanilla. Not very strong.  
    Sleep Tight: 6/10. Herbal tea with lemon, lavender, jasmine.  
    New Zealand Breakfast 6/10 . Black tea with kiwi. Definitely the most unique tasting of all these. 
    Gorgeous Geisha: 6/10. Green tea and strawberries. 
    Tummy Tea. 5/10. Herbal tea with fennel, liquorice, peppermint. 
    
    **Wouldn't bother brewing again:  
    English Breakfast: 4/10. Black tea. Same as any english breakfast. 
    Morning Sunshine: 4/10. Black tea blend. Weak, slightly bitter and acidic. 
    Milky Oolong: 4/10. Oolong tea with flavors.   
    Jade Mountain: 4/10. Green tea with rice, cocoa. 
    Canberra Breakfast: 3/10. Black tea with oats, cocoa, coconut. kinda musky and bitter. 
    White White Cocoa. 3/10. White tea, green tea, with cocoa nibs, coconut. Sounds great but bland with no aroma. 
    Irish breakfast: 3/10. Black tea. No taste. 
    
    **undrinkable:
    Lemongrass &amp; ginger: 2/10. Herbal tea with lemongrass and ginger. Sour. 
    Chai 2/10. Chai tea. I just dont like chai. 
    Packs a peach: 1/10. Fruit herbal tea with peach. Overpowering, bitter, bad aftertaste.  
    Tumeric ginger ninja: 0/10. Herbal tea with tumeric, ginger. Tumeric is nasty. I reviewed 32 of T2s loose leaf teas in 1 sentence each"
tea, Dropping a random tea cake photo for you all this Sunday
tea, Macro white tea trichome porn
tea,"Hello Just found this Sub from research on cold brew tea to see what I can learn.  


I have been a Soda drinker for a long time. just got off drinking soda a few yrs ago. I started to drink water but then got addicted to a Grocery store type iced tea and drink that like no tomorrow. I am looking to wean myself off that and drink some healthier options. I am partial to Iced teas but after trying a few hot teas looking to find the right combination of both types. 

&amp;#x200B;

I will mostly be looking to cold brew tea. my wife grows different mint plants so I will be able to  brew with these for some nice combos. Noob to tea"
tea,"

[View Poll](https://www.reddit.com/poll/nzr9xz) What’s your most favourite black tea flavour?"
tea,We've all had iced black tea but what about oolong? I have some dark loose leaf oolong I bought recently and was wondering if it's worth making any. Has anybody tried iced oolong tea?
tea,"Hi guys I've just started getting into tea somewhat recently and it's been an amazing journey so far. So I've experienced what in English is described as getting ""tea drunk"" twice, which I guess is mainly a very controlled caffeine buzz. I'm not sure if anyone can answer me this here but I'll ask anyway. So I'm researching different information on ""tea high/drunkenness"" and have come across two different viewpoints on it. So it's a very appealing and desired quality in the English world, aka having a very attentive but controlled mental state that is very pleasant. But when I look it up in Chinese, 茶醉 (tea drunk) it is a very negative quality, like they compare it to actually getting drunk and having similar side effects like headaches, nausea, etc. However, I've been researching more into Puerh and found that it does have some special effects like making you feel this heat in your body and giving you that supposed elevated mental state. The word 茶气 (tea energy? idk) is commonly associated with puerh and it's psychoactive effects. So my question is, are the effects you get from drinking Puerh noticeably different than from drinking other teas? Or can you have the same effect by drinking a higher amount of any other tea? If anyone knows chinese, can you explain the difference between the two and which one is supposed to be positive, and which one is negative? I appreciate everyone's help. Different types of tea drunk? 茶醉 vs 茶氣"
tea," Journal entry # 9: Exploring Shira Ore, a.k.a. Kukicha"
tea,I own a cast iron tea pot already at home but I’m interested in buying a ceramic tea pot and a ceramic cup. They’re a bit on the pricey side $85 and $25 respectfully. The pot is unglazed and it roughly fits 1 medium cup of tea. How do I use it correctly and how is the care for it? Any advice? I’m looking at getting the items from Lupicia tea shop. I like a few different teas so I’d be using it to brew all of them unless I shouldn’t. Question on using a ceramic teapot
tea,"Thought this would be an interesting experiment! Hopefully this hasn't been done recently. 

[View Poll](https://www.reddit.com/poll/nz5hz0) [POLL] Just Curious - How does this subreddit feel about coffee?"
tea,I was just doing a clean up of the kitchen and found some sealed foil packets from about 8 years ago. A quick sweep of the internet says it never expires. Is this true? I opened a packet and it wasnt clumpy. Is it OK to consume? How long does granulated Korean ginseng tea last?
