subreddit,combine_text
tea," Well this is a fun video it has been giving lots of people exposure to a tea field, processing, and gongfu cha. Would love to hear y'all opinions. Personally I could do without the flowers. *I will make a disclaimer she has gone on record before saying she has help making these videos.*"
tea, Iced kukicha #1 from Kettl was perfect for a hot afternoon
tea,"Recently had a colleague entice me with stories about amazing Thai teas. I asked if they actually mean ""Taiwan"", since I didn't even know Thailand was big on tea. But they assured me it was thai tea that they meant. 

So I looked all over the tea vendor list, but I was only able to locate one single place in Europe that sells thai tea, and that is [Palais des Thes](https://www.palaisdesthes.com/en/teas/single-estate-teas/thailand/?product_family=181) in France. And they only have 2 thai teas in stock as of the time of this writing. 

Does anyone else know of any high quality thai teas? _Must be shipping from Europe!_ I'm not interested in international shipping, because my country has an import fee on any package, regardless of contents, that comes from outside the EU. This means no British vendors, since UK is not an EU member anymore, and thus subject to full import fees. Looking for Thai tea within Europe"
tea,Any sources for certified organic puer? Looking for certified organic puer?
tea, A few days ago someone posted here asking who got into drinking tea because of Captain Picard. I just want to let whoever that was know that we’re best friends now lol
tea, My kyusu is developing a nice patina on the inside
tea,"With the summer weather upon us here in Canada I am looking for a couple great recipe ideas for home brewed iced tea either with or without alcohol.  Cheers!

&amp;#x200B;

https://preview.redd.it/wf2csky8ly171.jpg?width=2400&amp;format=pjpg&amp;auto=webp&amp;s=4984095768766c17278fa6bf6446a34a9bd9002e Summertea Sipper Recipe Ideas"
tea,"I found this playlist super interesting. Basically the guy filming parts of his sourcing trips at the farms and processing buildings, usually showing all the steps and some bits and pieces of other things as well. I found it has just the right amount of detail and is edited very well to not waste your time. 

This one was my favorite but there's a whole playlist; 

https://www.youtube.com/watch?v=eJvtO1NqmIg&amp;list=PLAtdGF0-xVNZ4BU92I2fvj7WAq4tsr9kL&amp;index=9 Interesting playlist of a tea buyers sourcing trips."
tea,"I'm pretty sure I have ADHD and no matter how much tea I drink in a day it just doesn't really give me a whole lot of energy and I never feel cracked out and I never feel like I have too much caffeine in my system. It kind of just relaxes me and sometimes makes me tired. The most tea I will have at a time is a full gongfu session with oolong where I do like 9 to 12 steepings. But still it doesn't energize me it sort of just makes me super focused. 

So how does the caffeine in tea affect all my adhd tea  drinkers here on reddit? Question for all my adhd tea drinkers..."
tea, I think hard working people deserve recognition
tea, I never had a tea party end like this.
tea, favorite parts of ceremony
tea, My new teapot!
tea," Spent a few blissful hours enjoying a wonderful pot of tea in my Wedgwood today, in the most idyllic meadow in the middle of nowhere (not pictured, fresh-baked scones with clotted cream and raspberry jam)"
tea,"Obviously several types of black tea go well with milk and sugar, as well as matcha and jasmine tea but are there any others? Tea and tisanes suited for milk and/or sugar"
tea, a cold friday with no obligations - time to get cozy!
tea,"hi there,

i was a huge coffee drinker for many years, but as i get older i can handle caffeine less and less well and i need to limit how much i consume to lower and lower amoun ts. i switched to black tea, which made a HUGE difference and i really really love breakfast teas, assam, stuff like that. 

i was hoping ppl had recommendations for black teas that are relatively low in caffeine that are still good. doesn't need to be ZERO caffeine, just lower than ordinary or the assam im drinking rn is fine. 

i don't know much about tea, but i know i like english breakfast and assam w/ cream. i tried the ""lapsang"" tea that's really smoky and i hated it fwiw.

 hope this helps u help me and hope this type of post is allowed. thanks a lot guys could you please recommend me a black tea without too much caffeine?"
tea,"I have a lovely white rose bush.  We do not use chemicals on it or any garden plants.  It has several blooms on it currently and I'd really like to make some rose water and rose tea with them.  I was hoping to get advice for the best way to get the most flavor.  Should I use only petals or petals and leaves?  Should I dry first in my oven at 140 (lowest setting) or hang dry? Or should I just use them fresh and gently washed? Any ideas on how long to steep?  Or at what temp?  I've made clover tea, dead nettle tee, and mint tea from my gardens before, but this will be my first from this rose bush. Making rose tea, how best would you go about it?"
tea, Té y lluvia
tea, Picking tea at Hangzhou’s Longwo tea fields - Longjing tea bushes
tea,"What are you drinking today?  What questions have been on your mind?  Any stories to share?  And don't worry, no one will make fun of you for what you drink or the questions you ask. 

You can also talk about anything else on your mind, from your specific routine while making tea, or how you've been on an oolong kick lately. Feel free to link to pictures in here, as well.  You can even talk about non-tea related topics; maybe you want advice on a guy/gal, or just to talk about life in general. What's in your cup? Daily discussion, questions and stories - May 28, 2021"
tea," With views this nice, you just can't resist a cup of Blue Flower Earl Grey out on the porch"
tea,"Very good morning to you, 

As I was searching for how much milk you should add to your cup of black tea, I noticed that some people use condensed milk instead of regular milk.

What would you consider the best way to have tea with milk in your opinion? Regular milk or condensed milk?"
tea, So I bought some Jin Jun mei from a local seller. Is this yellow powder normal?
tea,"I wrote a short summary of what the different broad categories of tea are in a Quora post:  [https://www.quora.com/There-are-four-types-of-teas-white-green-black-and-oolong-blue-In-what-way-are-they-different](https://www.quora.com/There-are-four-types-of-teas-white-green-black-and-oolong-blue-In-what-way-are-they-different)

It's really basic, so for plenty of people it wouldn't be informative at all, but another post here reminded me that different people are at different points in exploration.  This doesn't do justice to any of those types, or else it would be a lot of writing.  Pictures show some examples of dry and brewed versions of a number of examples; that fills in some extra scope, without adding reading demand. Overview description of main tea types (black, white, green, oolong, hei cha)"
tea, A nice find from cleaning out my attic. They belonged to my mom and we're sitting in a hutch when I was growing up. Since she passed they were in the attic.
tea, Hosen sencha while watching vincenzo
tea,"&amp;#x200B;

https://preview.redd.it/e12rhflcsv171.png?width=1080&amp;format=png&amp;auto=webp&amp;s=6fe257d22c905f74a5f338021078430839a8a66c

For a little backstory, I first had this tea when I was in elementary/middle school. It was supposed to be a seasonal flavor and I kept missing it at the local tea shop, In college, I found out that they stopped making it over 10 years ago and that I can't special order it through them since their supplier does not have the ingredients for it anymore. But it is one of my favorite cups of tea and I want to be able to share it with my partner someday.

I know it's a white tea with cinnamon flavor. It has some candy hearts, and some little sticks.

https://preview.redd.it/h61f24lttv171.png?width=2448&amp;format=png&amp;auto=webp&amp;s=844f96727341952993249abecf815a2498895f19

I really hope someone out here can help. I can take more pictures if needed Need Help Identifying 15 Year Old Blend"
tea,"Hi,

I've made my first order from Crimson Lotus Tea and there is a message saying that duties and taxes may be charged on delivery. I'm in the EU.

I was wondering if I will have to pay some, and how much that might be? Crimson lotus Duties and taxes?"
tea,"I saw a website called what-cha and I'm planning to buy loose leaf, specifically pu erh over there. Has anyone bought tea over there? If so, is it worth it? Loose Leaf Tea Inquiry"
tea,"Hey all, 

I really enjoy green tea and I want to find one that strikes the perfect balance of something that will wake me up but also doesn't have tons of caffeine so that I can drink a good amount of it. Currently I am drinking loose leaf gunpowder green tea, but I am quite sensitive to caffeine and I find that this tea has a fairly high caffeine content for green tea so I can only drink a cup or two at most. Can anyone recommend me a more mellow, but still high quality, loose leaf green tea that I can enjoy more of in the morning? Thanks! Green tea recommendation?"
tea, Before and after I added lime to butterfly pea flower tea
tea, I’m Delving Into Bagged Tea. Recommendations?
tea,"We can probably expand this list more, but Polls only allows 6 options, so I tried to condense them as best as  I could. 

What are your favorite tea flavors? Since Polls doesn't let you pick more than one (that I can find) just pick your favorite and leave a comment on how you like to combine them? 

Personally, I like Warm, woody flavors like Ginger and Cinnamon in a good African Red. 

Or some Clove mixed with Dragon Well and Maple Syrup. 

Herby/Grassy Teas are good, though I tend to lean more towards things like Peppermint, things with strong flavors, in that category. 

My LEAST favorite are the Floral teas. I just can't develop a liking to most of them. 

[View Poll](https://www.reddit.com/poll/nmlahr) What is your favorite ""Note"" in your Teas?"
tea,"So basically I want to try out the Long Island strawberry green tea from top of the morning but I don’t know if it’s any good so I’m on the fence about. If anyone has tried it I would really like to hear your feedback on it because I’m honestly deadset on the middle of wanting to get it and deciding it’s not worth it So, top of the morning tea, has anyone tried it?"
tea," Excellent Bai Cha from february this year, tasting notes in captions 🍃"
tea, [Mourning] RIP M&amp;L Siting
tea,"I’m curious as to what your guilty pleasure drinks are. We all like a good quality tea here, but I want to know which overly milky, unreasonably sweetened, barely tea drinks comfort you. Once in a blue moon I like an iced chai from Panera. It’s far too sweet and sorta reminiscent of incense, but it does something impossibly comforting for me. What’s your favorite chain cafe/coffee shop/ etc. drink?"
tea,"Looking for teas with a little more caffeine but very mild astringency. Any suggestions? Obviously some Pu Erh teas fit the bill, but what about others? I would love some greens/whites. + caffeine | - astringency"
tea, Enjoying some 2021 pure bud green tea from YS this afternoon!
tea,[https://www.youtube.com/watch?v=3KfvUCKxCts](https://www.youtube.com/watch?v=3KfvUCKxCts) Just something to watch while enjoying afternoon tea🍵
tea,"Hey all! With this year's puerh season upon us or otherwise rapidly approaching, I'm interested in picking up a 120ml silver teapot to add to my more clay heavy collection. Do you have any recommendations on where to pick one up? Are you selling yours? Let me know! WTB - 120ml Silver Teapot"
tea, Beautiful moment in the creation of a cup
tea,Yours truly is missing fall weather right now. What teas would you drink that scream fall to you? Favorite Fall/Autumnal Blends?
tea,"hey does anyone have a bubble tea recipe that tastes like the kind they make at the boba shop? ive tried making it several times but it doesnt really taste the same, idk why bubble tea recipes !!!!!!"
tea,"I like to use ""Add ins"" for some of my teas. They can really bring out a new level of flavor and dimension. 

Recently I've been using Chinese Five Spice for some of my more Fruity, Spicy and Sweet teas. Things like Cherry Hibiscus, Beagle Spice (Celestial brand) or Ginger Dragon Well. 

But Chinese Five Spice doesn't lend itself well to Colder Teas, as it doesn't dissolve easily. 

So I've been looking in to alternatives. I've narrowed it down to the Clove and Star Anise components that work best. Clove is easily enough, but  star anise suffers the same problem as the cinnamon; its great for hot teas, but doesn't dissolve easily in cold ones. 

Someone recommended trying licorice powder instead. But its hard to find for some reason. 

Anyone know if it will work? and if so, where I can get it? Licorice Power to add to Fruity and Spicy Teas?"
tea, Just a photo of Taiping Hou Kui tea
tea, Throwback to when there still were snow
tea, Teatime with Totoro!
tea,"I enjoyed this article from the Real Change about our local tea houses: [https://www.realchangenews.org/news/2021/05/26/seattle-s-communi-tea](https://www.realchangenews.org/news/2021/05/26/seattle-s-communi-tea) Great article about local tea houses (Seattle, WA, USA)"
tea,"I wanna try something new next paycheck.I managed to  cut my choices down to these four. which one would interest you the most if you had to pick?

[everything about this sounds fantastic ](https://preview.redd.it/1p34bla8so171.png?width=1538&amp;format=png&amp;auto=webp&amp;s=0f8fe7932c5b355e3855de92246e18797ff84ab5)

&amp;#x200B;

[I'm a sucker for cinnamon and black tea](https://preview.redd.it/xebmb4koso171.png?width=1568&amp;format=png&amp;auto=webp&amp;s=30f1ed1ee66d5bc2f53825659477890f151028a2)

&amp;#x200B;

[haven't tried many oolongs, sounds good though!](https://preview.redd.it/dzg6gfkjto171.png?width=1496&amp;format=png&amp;auto=webp&amp;s=4701ee50a329e03831f27e2f70f03e7b7a945ced)

&amp;#x200B;

[also haven't tried many \(if any thinking about it\) white teas, not sure what to expect.](https://preview.redd.it/32ryd7hwto171.png?width=1521&amp;format=png&amp;auto=webp&amp;s=ed2ca70ba8a838317fd4ec5e556f12062df44284)

[View Poll](https://www.reddit.com/poll/nmbi8m) help me make choices because I suck at it!!!"
tea,"I ordered a Shoin matcha from Ippodo and it arrived today. I brewed it according to website instructions and found despite the more rounded profile (known for being less astringent than some counterparts), it was the overall vegetal aspect that turned me off, as well. A part of me knew this would be the outcome, yet I can't help but feel slightly disappointed as I am ""out of the loop"" here. I feel like everybody treasures matcha/green tea variants and that for aforementioned reasons, my palate will never expand beyond child-like café stocked basics. I Might Be Flavor Profile Locked"
tea,"I’m considering in making my own tea blends. I’m just not sure how to start or go about it. Maybe even do my own small business on it. 

So my questions are...


1a. Do I have to plant my own herbs? (I know dumb question sorry) 

1b. If I do, is it better to plant in ground or in a garden box? Or inside the house? 

1c. If I don’t need to grow my own, how do I get the different leaves in bulks? And would it be okay to sell my own using those bulls from a different company? 


These questions are if I do grow my own....

1. How do I dehydrate? 
2. If I don’t dehydrate, how long do I wait till it grows and I’m able to use and infuse? 


I don’t know. I know I have my questions but I want to try to be simple for starters. Please any info would be helpful. 🙏🏽🙏🏽 Anyone able to help?"
tea, A tea station my sister and I built to make our favorite Jasmine tea and chamomile of course.
tea,"I am looking for a good breakfast tea that is caffeinated.

&amp;#x200B;

Update: I've taken some of your advice and decided to try Irish breakfast tea. I also decided to get some double bergamot earl grey black tea and double chai while I am at it. Thank y'all for the suggestions. What is your favorite breakfast tea?"
tea, I see your Tea Cabinets and lower you a Tea Crate. I really like milk crates.
tea,"I've recently moved countries to a place with extremely hard water, and I've noticed my teas taste flat and bland suddenly, so I was wondering what your methods of choice are to prevent this? I was thinking of something along the lines of a Britta filter but I've heard they're not that good. Any suggestions? What water do you use for your tea/ what kind of filter do you use for hard water?"
tea, Oh the joy of needing to bring Tea everywhere you travel 😏
tea,"I am very new to the tea scene and am looking to purchase this [teapot+cup](https://eco-cha.com/collections/teaware/products/white-porcelain-single-brew-teapot-and-teacup) from eco-cha, along with my tea order. I can't find much info about where they source their tea ware and was wondering if any of you have experience with the company. It's expansive (at least for my budget) but I love the way it looks and don't currently have a good single brew method outside of grandpa method.

Thank you very much for your time, and may all your brews be beautiful. Has anyone bought tea ware from Eco-Cha? If so would share your experience?"
tea,"I've tried the basics and Hojicha tea before If I like the uniqueness of Lapsang Souchong, what other teas would you recommend?"
tea," a great afternoon book companion - assam tea, brewed for 4 minutes"
tea, Hmmm
tea,For those who use milk alternative ls what's your favourite to use in tea? Milk alternative
tea, Finally added shelves to my tea area. Makes me so happy to see everything displayed and accessible!
tea, Masala chai served in kullhad (earthen glass) just hits different.
tea,"What are you drinking today?  What questions have been on your mind?  Any stories to share?  And don't worry, no one will make fun of you for what you drink or the questions you ask. 

You can also talk about anything else on your mind, from your specific routine while making tea, or how you've been on an oolong kick lately. Feel free to link to pictures in here, as well.  You can even talk about non-tea related topics; maybe you want advice on a guy/gal, or just to talk about life in general. What's in your cup? Daily discussion, questions and stories - May 27, 2021"
tea,hi! i have a few butterfly peas flowers in the garden and i wanted to dry them and use it to make tea. I was just wondering if i could use the dried up flower to drink or if there's a step i am missing just in case. Drying Butterfly Peas
tea, My favorite green tea with jasmine. Go Twinnings!
tea, How to brew? A friend gave these to me but not sure how to best use them.
tea, Seattle’s communi-tea
tea,"I'm getting into pu-erh tea and I'm curious, if I buy several different cakes then I'd have 1 of each and slowly drink it over time. Or if I found one I really liked I could get a tong then slowly sample 1 cake and then have the rest aging which I can break apart and drink when my test cake is at a stage I particularly like.

I imagine people do a mix of both and probably lean more towards single cakes as that fits the leanings towards FOMO these days, or maybe I'm feeling cynical at the moment. 🙂 Pu-erh drinkers: do you buy a range of teas or do you buy several cakes of one tea to age?"
tea,"I read about Smokey Earl Grey, but it's not available where I live, so I put together a loose leaf blend of Earl Grey, Lapsang Souchong and Keemun (1:1:1 in this iteration)  


I'm enjoying it - a nice, round, lightly smoked flavor with that underlying Earl Grey sensibility - and it got me wondering: What DIY blends of teas do you enjoy? DIY blends of teas?"
tea, Grandpa style drinking: you should give it a try
tea,"Hi everyone!

Someone tasted tea from White2Tea? Especial interesting in Ripe Puerh. If yes, kindly ask to say which the tea and your opinion. white2tea tea, need your opinion"
tea, Hello- trying to lesson my energy drink and coffee consumption in the office. What should I buy for tea gear and what are some good teas to try?
tea, I added sugar and half and half to my tea and this happened. ????
tea," Taste testing done locally purchased teas. This is educational for me as well, since I don't REALLY know how they taste different from each other. 5 minute steep in 208°F water."
tea, I really like Lu’an green tea
tea,"We were at a little Chinese restaurant today, and the house tea tasted very much like houji.  It's not impossible, of course, but every Chinese(-American) place I've been to chooses either jasmine or oolong, so I was a little puzzled.  Unfortunately, the tea was in a nice, anonymous bag, so a peek in the pot didn't help, and I didn't get a chance to ask the waiter.  Thoughts?  Theories?  I'm a black and green person, myself, so this is outside my knowledge base. Is there an oolong that tastes similar to houjicha?"
tea, Cichlids have no manners!
tea,"Hey everyone. I will be doing some travel to see family in July and wanted to know how everyone travels with their kit. The main things I want to bring are my kyusu and yuzamashi. Cups would be nice, but not too important. The tea is fine. I can bring it in the bag or use a canister. Looking for recommendations on how to travel with a kyusu and yuzamashi."
tea, Is there a possibility of radiation pertaining in Japanese origin macha powder?
tea,"Sorry if this is a silly question, but I’m having a hard time trying to figure out a next step for me. 

I’m a decently avid black tea drinker and only recently tried green tea. I’ve tried a cheap grocery brand (which I strongly disliked due to very vegetal flavors), and Bigelow (which I really love for the full and fresh taste). I was wondering what a good next step would be. Sencha seems to be very popular around here, and lots of people seem to recommend oolong. I usually just drink tea straight if that’s relevant. My main reasons for not just continuing with the Bigelow bags is to reduce waste and find something that’s fair trade if possible. 

Anyway thanks for any help! Getting into green tea?"
tea, 2021 Uji Shincha from Ippodo Kyoto :D
tea,"I always brew gongfu style and I usually do it alone. I use 5g of leaves per gongfu session and it's pretty crazy how 5g can produce a liter of tea. I have 2 gongfu sessions in a day so that basically means I drink 2 liters of tea per day. Lots of people here on this sub use the gongfu method to brew tea and gongfu sessions should produce at least a liter of tea considering the amount of leaf used per session. Anyway, is it safe to do this? 2 liters is a lot of tea. Is it safe to drink 2 liters of tea a day? Does anyone else do this?"
tea,"*reposted because of annoying typo in title...*  
Context: Born, raised in Britain, so always had tea + milk in background (Tetley's, PG Tips, Yorkshire), then two decades in Taiwan with the iced tea street culture. But also got into the habit of drinking a couple of beers at the end of each day, more at the weekends

Got sick of drinking during lockdown, gaining weight, making bad food choices, occasional hangovers, the dull habit and the expenditure on something that wasn't good for me

Stopped drinking just before my last birthday, and decided to channel my natural OCD/habit-forming nature into tea, buying a selection of loose leaf green, black and white teas, fruit/herbal tisanes and a nice cast iron teapot. Ritual and aesthetics are important to me, as is the ability to get wired or chill-out

Two months in and the habit has stuck. I drink tea all day - moving between the various teas, then onto herbals in the late afternoon, sleepy times in the evening (plus water, to cleanse the palate, stay hydrated)

Anyway, for me the move from alcohol to tea was easy, \*but\* did involve total commitment/obsession until the habit stuck, something that was fun to throw myself into, like this subreddit (thanks) Anyone else use tea to move away from alcohol?"
tea, Just cant go wrong with green tea
