subreddit,combine_text
tea, My Tea Shelf
tea, Having some Shui Xian this afternoon.
tea, Milky Oolong tea at the Lake!
tea," I'm always delighted when new tea arrives. Loving these mini 60ml gaiwans, it really is perfect for solo brews and for comparisons."
tea,"I've never really liked RED TEA 紅茶 (fite me) before buying this awesome Golden Monkey RED (ok I'll calm down). It's actually very flavorful and delicious, but for some reason the last two times I've brewed, the flavor drops sharply after the second or third steep. I was wondering if this is due to temperature control? I'm just using an old tea kettle lying around, so after hearing it up to around the correct temperature the first time, the temperature just drops over time somewhat quickly. Plus I have the AC sitting around 78 degrees lolo.  It's still hot but not where my fingers get burnt holding the gaiwan. Is the reason the flavors aren't brought out so much affected by the drop in temperature? I guess I kinda assumed that, the first pour is to open up the leaves, and the rest is to soak up the flavors. 

Tldr Should I keep a relatively constant temperature with each infusion in order to maximize the flavors?

edit: I'm using Gongfu cha method btw Dumb question, but does the temperature have to be the same throughout each infusion?"
tea,"   
I've heard of black, green, white, oolong and pu-erh tea but I don't know the exact difference between them. Are there other types? and what are the differences? I'm looking for a strong tea to replace coffee in the morning and a tea a little weaker to keep me active in the afternoon, what do you recommend? 

&amp;#x200B;

Note: I'm Brazilian and I don't speak English, sorry for any writing errors difference between types of tea"
tea,"Hi Reddit,

I'm looking for a nice tea to get my dad for Father's Day. With mail being super slow these days, I'm hoping to order early so that it arrives on time. I'm not super educated when it comes to teas, so I'd love some advice from the pros :) 

I got him [this tea](https://www.amazon.com/gp/product/B00YIRK96Q/ref=ppx_yo_dt_b_search_asin_title?ie=UTF8&amp;psc=1) last year and he loved it so much that he asked me to reorder it. I got lucky with that pick and would totally buy it again for him this year, except he doesn't want me to get it for him anymore after he found out how much it costs (won't be making that mistake this year!) He really likes green and oolong teas, but nothing too floral or fruity (jasmine is okay). What would you recommend? Gift suggestion for my Dad?"
tea,"About talking to a main founder of the modern Russian tea tradition about cultural themes.  He is credited as a primary influence, by a number of Russian tea vendors and enthusiasts that I've spoken to.  This talk was mostly just an introduction, not getting far with themes like Russian uptake of Chinese tea tradition forms, and Taoism and the I Ching as fields of personal study.  Bronislav started studies and works as an academic interest, with tea club and group development as an outgrowth of that.  That last step mainly occurred over the 1990s, now somewhat integrated in an established subculture in Russia. 

&amp;#x200B;

https://preview.redd.it/184v8g1b7z371.jpg?width=720&amp;format=pjpg&amp;auto=webp&amp;s=7bab74140daa79ba27321c61014c5428053e1f3b

[http://teaintheancientworld.blogspot.com/2021/06/talking-to-bronislav-vinogrodskiy.html](http://teaintheancientworld.blogspot.com/2021/06/talking-to-bronislav-vinogrodskiy.html) Talking to the founder of the modern Russian tea tradition"
tea, Tea for one (or 3?)
tea,"There's a heat wave here and I need to figure out how to cold brew my tea! Most recipes I'm finding say how much to use by volume but I have several different kinds of loose leaf green tea, in all shapes and sizes, so I'd love a recipe by weight. Leaf to water ratio for cold brew tea?"
tea,"Good morning! I am new (ish) to the wonderful world of tea. I grew up in the southern parts of the US where sweet tea is *the* drink, but was never able to enjoy it. As I got older, I continued to try to enjoy other types of tea because of the ""advertised health benefits"" *(the rules say not to discuss the ""health benefits"" due to the complexity of the subject, but I mention it for context. I'll edit it if this isn't ok)* and even worked for Teavana for a short period of time; it's also my favorite reason of termination (""I just don't think you have the *finesse* for tea.""). All to no success or enjoyment.

I'm a big fan of the show Avatar the last Airbender*, and that's one of the reasons I have found the light: I read a post that used Uncle Iroh's love for jasmine tea to underscore the complex character writing for the show. For those of you unfamiliar, Iroh is considered one of the best characters because of his deep wisdom and incorruptible patience. The post went on to describe how patience is necessary to brew more delicate teas like green and jasmine tea, lower temperature is recommended, etc. My bestie happened to have given me some extra green tea she had, and I finally have a big girl cooking thermometer; the tips worked! So here I am, that's my tea journey. I'm glad I stuck it out and kept trying. 

On to the discussion (if you read it, thanks for listening!).

So I've been getting into this tea thing, and I started looking into kettles (because right now, I'm just heating water with a sauce pan lol); which lead to trying to find what the best material for kettles should be; lead to an article (I think I found on Reddit, no less) that described the which kinds you should use and why. Silver was the winner (after gold, but it's so lavishly unattainable), followed by glass, and then steal and stainless steel. Now, I agree with Uncle Iroh when he says, ""The best tea tastes good whether it comes from a tin cup or a porcelain pot,"" and if I spend the rest of my life heating my water in a sauce pan, that will be 100% ok with me. But I'd be lying if trying a cup of tea from a silver pot doesn't get me going a little. 

Fortunately, silver pots come at a very cheap price of $2-3k (/s). So probably not gonna happen for me any time soon. 

I do have a small peice of real silver. Idk the purity level, but it has the iconic *ring* that silver makes when clinked, and when I placed ice on it and a metal spoon, the ice on the silver melted faster. According to multiple sources, those are real ways to test whether silver is real or not. It's just a small jewelry container, though, not nearly enough to fill a cup, much less a pot. The article I read tested the effectiveness of the silver by pouring water boiled in a clay pot into a silver one for 10 minutes. The both waters were poured into cups and random strangers were asked to taste them and identify if one tasted ""different."" 96% of the time, the silver water was identified as ""better."" 

So with this in mind, what I'm thinking is that if I place my silver doo-dad into the water for a short time before steeping my tea, that it will give me a better tea, right? I'd love a discussion, but I'm definitely gonna try it, anyway. 

Tl;dr: silver has been shown to be the best method for brewing tea. I can't afford a silver kettle, though, so I'm going to test this by placing a silver trinket in my water. Updates provided in comments. Thoughts, comments, and suggestions welcomed!

*If you've never watched the show, I highly recommend it. It's supposed to be a ""kids show,"" but I'm almost 30 years old and I still love it. It's aged well, well written, has complex characters and is known for its incredible character development. I'm gonna be restarting it soon to celebrate my new love for tea! Silver and tea (long post, tl;dr provided)"
tea, Breakfast in Paris my new favorite tea!
tea, What I would give to have one of those cups for my Gong Fu setup…
tea,"We realize there are lots of people involved in the tea industry here, so this thread is a weekly feature where anyone can promote their current projects without worrying about the self-promotion rules.  Feel free to include links to your shop, crowdfunding sites, surveys, sales, or discount codes.  The rule against claims of health benefits remains in effect here.  It should go without saying that we still expect people to be respectful and follow the reddiquette.  While we intend for this to be a free-for-all promotion zone, please don't overrun the thread posting the same thing over and over. Marketing Monday! - June 07, 2021"
tea, First pick green tea
tea," Logging some Ruby GABA 😬 let the sesh, commence!"
tea, To all the tea heads out there. What food or snack do you eat together with your tea?
tea, I recently got into loose leaf tea and found these beauties at an asian market. (See captions for more info)
tea,"Does anyone here has tried the Ahmad Tea? Is it of good quality or just some kind of low-class tea in the market? I actually drinking it every day. I bought one box of black tea (fruit tea selection) and I really enjoyed the tastes especially the Passion fruit and the Apple one because the smell is really nice. I'm drinking it 3 times a day and been a substitute for my coffee as I have GERD. Just want to ask if my daily in-take is bad as well this tea brand?

Can you also advise me of the brand of tea in the market, I  am eyeing the Traditional Medicinals and Yogi for a change. Would like to look for a tea that is good for my digestion and bloatedness/gas as well as relaxes me when I am tense due to my stress and anxiety. Is the Ahmad Tea good to keep? Ahmad Tea, anyone?"
tea,"What are you drinking today?  What questions have been on your mind?  Any stories to share?  And don't worry, no one will make fun of you for what you drink or the questions you ask. 

You can also talk about anything else on your mind, from your specific routine while making tea, or how you've been on an oolong kick lately. Feel free to link to pictures in here, as well.  You can even talk about non-tea related topics; maybe you want advice on a guy/gal, or just to talk about life in general. What's in your cup? Daily discussion, questions and stories - June 07, 2021"
tea, Went to grandpa’s and came back with a few teas for identification
tea, An amazing first impression trying beautiful taiwan tea company oolong teas
tea, New H&amp;S Haul: couldn‘t resist to order them all!
tea, Realized the gif feature! Brewing ripe puerh outside the best bakery.
tea,"Why do you make tasting notes when drinking tea?

[View Poll](https://www.reddit.com/poll/nu6co3) Question about tasting notes"
tea,"Hey everyone! Hope you all enjoyed your weekend. I'm thinking of adding a kyusu to my teapot collection. However, I'm not really seeing the benefits of a kyusu over a traditional western style teapot. I have a nice teapot with a large-ish strainer basket that I feel could do the same job as a kyusu. So what are the benefits of a kyusu over a cast iron western teapot?

EDIT: I didn't clarify this, but the cast iron teapot I use is strictly for infusing tea. I have a separate electric kettle used for heating up water. This is why I dont see the benefit of a kyusu over a western teapot. Hope that helps! Kyusu worth it?"
tea,"I'm looking to go exploring. I've tried Adagio, Tiesta, and just bought some David's Tea samples which I've yet to try. I really love Adagio's point system and Tiesta has one flavor I really love but I want a permanent tea supplier that is both quality and not going to break the bank. Any suggestions, or favorites? High price is okay if it's really THAT good.

Edit: I just saw there's a page/post for this! Unfortunately I'm looking specifically for sellers that do dessert teas while still having classics. I'm not quite into master teas *yet*. If anyone could share some suggestions, I'd be grateful! Hi everyone! What are some of your favorite loose leaf tea brands?"
tea,"Make tea by ceramic teapot. The water temperature should be controlled in 85 - 100  ℃ .

https://preview.redd.it/vet4emgyos371.jpg?width=1053&amp;format=pjpg&amp;auto=webp&amp;s=173245fec55a4aeb1ca4fdbadb2a51eedff052ee Make tea by ceramic teapot"
tea,Except this liquid tastes a lot better Grandpa style is the tea version of a lava lamp
tea,"My wife and I found a tea bar near us and loved it. Sadly, due to covid, it is closing. We bought some loose leaf from them and will try to go back for more soon. But we brewed some Tie Kuan Yin Jade I roasted oolong and it’s delicious! Has anyone had it before? Delicious oolong"
tea," I started my tea journey last December, I've grown addicted. I wanted to share my (current) setup."
tea, Some of my favorite flower teas
tea,"I know there’s probably dozens and maybe hundreds of different websites to purchase loose leaf tea. Which ones have y’all enjoyed using?

I’ve been mostly using The Tea Spot and Tao of Tea and Simple Tea Company. 

I used to buy from Zens Tea House from their website and store. They are local to me. Their main store is about 20 mins away from me. but I found out not too long ago the owner is actually a dick and they don’t treat their employees good. So I stopped giving them my money. What websites do y’all use for Loose Leaf Tea"
tea,"I recently finished off my essential collection for Red Blossom Tea Company and found 2 of the teas I enjoyed. I would like to find different but similar teas to keep expanding my palate. I liked their:

* Lincang Shou Pu-erh 2012
* Dragon Pearl Jasmine Supreme 

If anyone has any recommendations I would be grateful. The world of tea is new to me and still seems far to vast.   


Links for easy finding:  
[https://redblossomtea.com/products/lincang-shou-puerh-2012?variant=37236488994998](https://redblossomtea.com/products/lincang-shou-puerh-2012?variant=37236488994998)  
[https://redblossomtea.com/products/dragon-pearl-jasmine-supreme?variant=31627151620](https://redblossomtea.com/products/dragon-pearl-jasmine-supreme?variant=31627151620) Looking for suggestions"
tea,"So basically I have this thing where I need to come up with a brand name  and logo for a 100% natural with no added ingredients green tea brand. Now my target audience is 18-25 year old ppl. The green tea will be coming in nature inspired/unconventional flavors and I also need to come up with a label design for the bottles which will be (200ml, 330 ml and 750 ml).

I've decided on a few names- SereniTea// Naturaza// GreenX// Purganico

Pls give me suggestions and feedback and help me w the other stuff if you can. Thank you:\_) Green tea lovers I need your help"
tea," Young guy just got into tea, this is my first few teas, opinions in the comments"
tea, A tea experiment: part III - tasting
tea," Anyone else have a dog that really likes tea, and will steal your cup if you’re not looking? My normal morning cuppa: Yorkshire gold with a little half and half"
tea, Best place to buy hibiscus?
tea," Help identifying teas samples, please"
tea,"If I want to be able to brew 6-7 grams of a large, broad leaf taiwanese oolong tea in a gaiwan while using 100ml of water, what size gaiwan will I need? Do I need one that is bigger than 100 to account for the size of the leaves? What size gaiwan do I need?"
tea,"What are you drinking today?  What questions have been on your mind?  Any stories to share?  And don't worry, no one will make fun of you for what you drink or the questions you ask. 

You can also talk about anything else on your mind, from your specific routine while making tea, or how you've been on an oolong kick lately. Feel free to link to pictures in here, as well.  You can even talk about non-tea related topics; maybe you want advice on a guy/gal, or just to talk about life in general. What's in your cup? Daily discussion, questions and stories - June 06, 2021"
tea, I'd always wanted to have a tea box similar to Sheldon's in TBBT. Now I have one!
tea,"Hello everyone 

First of all, thanks to this subreddit - I have been able to enjoy and indulge my new tea drinking hobby that I started last year. 

However out of abundant enthusiasm and curiosity, I ordered a lot of flavored teas from Harney’s and David’s that I did not enjoy(eg chocolate chai, macaroon and s’mores flavored black tea etc). So question is, what do you do with boxes of tea that you don’t like? None of my friends drink tea so donating them is ruled out. 

Any ideas or suggestions welcome :)

Thank you. What do you do with tea that you don’t like?"
tea," I just got my first loose leaves! And I was wondering if I can reuse them? If so how many times, and will the flavour retain? And how should I dry them? Also the tea I got is green, if that information helps in any way :D"
tea," Looking for this style of tea set, but other patterns. Any suggestions on what to search for or stores to check?"
tea,"I like to drink green tea as a preworkout because im sensitive to caffeine and I dont crash. But, I heard green tea lowers your blood pressure and you shouldnt workout after drinking it. Is this true? Green tea as preworkout?"
tea, What are you drinking now?
tea,"I'm looking for a source of an oolong tea that my GF's mother brought back from a trip to Hainan, China which has a very nice coconut taste.

Does anyone recognize it?

Offered reward: 30K Internet karma points.

https://preview.redd.it/vvcrgm22tl371.jpg?width=2203&amp;format=pjpg&amp;auto=webp&amp;s=f81e95d0ee77b289a443e2df3487ad3961c66ffb Help me find this tea from Hainan China?"
tea, Can I use a ceramic pot as a tea kettle?
tea, interesting article
tea," 阿里山金萱 (Alishan Jin Xuan) with a simple, utilitarian gong fu setup."
tea, First cup of tea in my new house!
tea," Former Tea Box, to Tea Chest! Currently also building a Grid for my 16LB of Loose Leaf. I'll give tea tips too."
tea, Why does this tea just look like a bag of mud when wet? I would say it's been ground to find but who grinds tea into powder? Royal Crown sweet dream tea.
tea,"My mom bought me a box of bagged white tea today. However, the best before date was  in Feb 2014. Is it still good to drink, if not then is there anyway I could use them? It feels like a waste since she just bought the box. Questionable tea"
tea,I randomly searched 'green tea loose leaf' and [this](https://www.amazon.com/Organic-Gunpowder-Green-Resealable-FGO/dp/B07XM9GYYS/) is apparently 'Amazon's Choice'. Seems too cheap at $15/lb... has anyone tried it? Or any recommendation for a better option for a not-very-sophisticated-tea-drinker? Any opinion on 'FGO' green tea? It's amazon choice for green tea
tea, Where do you usually purchase your tea? website or blogger?
tea," I had my first experience with ""proper"" green tea and while i loved my budget Gong Fu ceremony, taste was lacking which I guess was my fault entirely. I'm hooked either way!"
tea," My favourite Yixing zisha teapot, it is so cute."
tea, I finally have a tea spot!
tea,Any information will help What chinese teas can you drink at night?
tea, Trying pu-erh for the first time
tea,"Does someone know if there is a scientific study about how the claypots change the content (minerality, bituminous binding usw.) of tea and water?

Thanks for help. Tea before and after clay teapot"
tea, For all you Aldi Shoppers - check out these loose leaf Aldi finds!
tea,I typically only get cups with a white inside so that the color of my tea can come through. I wonder at what point does this limit me from getting certain interesting cups that might have a different inside color though. There are two 1920’s flower painted tea cups I could get for not much... but they’re green in the inside! Are you picky about the inside color of your cups?
tea,"What are you drinking today?  What questions have been on your mind?  Any stories to share?  And don't worry, no one will make fun of you for what you drink or the questions you ask. 

You can also talk about anything else on your mind, from your specific routine while making tea, or how you've been on an oolong kick lately. Feel free to link to pictures in here, as well.  You can even talk about non-tea related topics; maybe you want advice on a guy/gal, or just to talk about life in general. What's in your cup? Daily discussion, questions and stories - June 05, 2021"
tea, Anyone know what brand this is?
tea, “Make-do” 17 c. Jingdezhen Teapot
tea," Is this teacup safe to make tea/drink from? I got it from a thrift store and hand washed it with soap and hot water, it’s got a very shiny glaze on the cup and saucer and seems to be from the company “Royal Sealy China”"
tea, What is this brand of earl grey tea?
tea,Title says it all. Want some good oolong. Not picky. Taiwan sourcing or floating leaves tea
tea, Dated House Dated Tea
tea, Will you difficult for you to sleep if you drink tea before sleep
tea,"Hello everyone, I’ve recently got into tea and I’m unsure If i’m making my tea correctly. The reason I am suspicious is I like the taste of all my tea, including the black tea, and I was expecting it to be somewhat bitter and require time to get used to. For example I just made a cup of black chai, here’s how I made it.

Water temperature of 208 F.

1.75 teaspoons of loose leaf black tea

Steep for 4.15 minutes in 8 ounces of water

[Here](https://ibb.co/pPrL6q0) is an image of the tea.

I really expected the black tea to be overly powerful and require cream and sugar, but it’s actually quite good and not bitter— is this because it’s good tea and made correctly, or because it’s weaker than it should be. I know the most important part is if I like the taste, but i’m just nervous I could do more with my tea. Thank you! New to tea, I can’t tell if i’m making tea correctly."
tea, Another addition to the family. I promise this is my last one.
tea, Which tea to pick?! Tasting and choosing spring harvest of Wenshan Baozhong tea in Pinglin area of Taiwan
tea," For tea person, how do you choose your favorite teaware?"
tea,"Hey, looking to see if I'm doing something that can be fixed. At work, I've been doing grandpa style Fijian anxi Jin Xuan milk oolong. Yeti mug, 175 degree water (figured lower better for grandpa). First water tastes great all the way to the end. Exactly the flavor I expect. When I add more water later in the day, the flavor is distinctly more fishy/seaweedy. It's not bad, but if you told me it was a totally different tea I would believe you. 

Is this expected ( I know with gong Fu, different infusions will give different notes), or something that can be fixed? Need advice: second water of grandpa style milk oolong."
